{
  "environment": "staging",
  "sample_set_id": "editor-perf-v1",
  "captured_at": "2026-02-26T01:59:49.419922+00:00",
  "captured_by": "louis.shawn@qq.com",
  "records": [
    {
      "scenario": "editor_detail",
      "p50_interactive_ms": 3068,
      "p95_interactive_ms": 4137,
      "first_screen_request_count": 1,
      "notes": "{\"probe_mode\": \"api_ttfb\", \"url\": \"https://louisshawn-scholarflow-api.hf.space/api/v1/editor/manuscripts/a36fa113-d011-4d46-b8ba-aa5662f20b58?skip_cards=true\", \"method\": \"GET\", \"samples\": 8, \"failed_samples\": 0, \"ttfb_min_ms\": 2872, \"ttfb_max_ms\": 4137, \"ttfb_mean_ms\": 3238.12}"
    }
  ]
}
