{
  "environment": "staging",
  "sample_set_id": "editor-perf-v1",
  "captured_at": "2026-02-26T01:26:39.195308+00:00",
  "captured_by": "louis.shawn@qq.com",
  "records": [
    {
      "scenario": "editor_workspace",
      "p50_interactive_ms": 1881,
      "p95_interactive_ms": 3646,
      "first_screen_request_count": 1,
      "notes": "{\"probe_mode\": \"api_ttfb\", \"url\": \"https://louisshawn-scholarflow-api.hf.space/api/v1/editor/workspace?page=1&page_size=20\", \"method\": \"GET\", \"samples\": 8, \"failed_samples\": 0, \"ttfb_min_ms\": 1838, \"ttfb_max_ms\": 3646, \"ttfb_mean_ms\": 2213.12}"
    }
  ]
}
